{
  "brand_name": "Roborock",
  "brand_handle": "roborock_us",
  "tagline": "Cleaning, perfected — so you don't have to.",
  "mission": "Free people from the cycle of cleaning so they can spend that time with the things — and people — they love.",
  "story_short": "Roborock was started by engineers who got tired of the gap between robot-vacuum marketing and reality. We obsessed over the brushes that wrap pet hair, the maps that lose track on day three, and the mops that just push dirt around. Today our lidar-mapped, auto-washing, pet-hair-eating robots do the cleaning so you get your evenings back.",
  "tone": {
    "voice_descriptors": ["confident", "engineering-precise", "warm", "no-nonsense", "wry"],
    "persona_archetype": "The Sage (knows the spec sheet) crossed with The Caregiver (actually wants you to enjoy your home)",
    "do_phrases": [
      "We measured this so you don't have to",
      "Watch it work",
      "Engineered for the messy weeks, not the showroom",
      "Set it and actually forget it"
    ],
    "dont_phrases": [
      "Revolutionize your home",
      "Game-changing AI",
      "Smart cleaning solution",
      "Take back your time (cliché)",
      "World's #1 (unverifiable hyperbole)"
    ]
  },
  "visual_system": {
    "palette": {
      "primary": "#0F1B2D",
      "secondary": "#F5F5F2",
      "accent": "#FF6B35",
      "neutrals": ["#2D3748", "#A0AEC0", "#E2E8F0"],
      "rationale": "Deep navy primary signals trust + engineering credibility (vs the all-white Apple-clone competitors). Warm orange accent draws CTAs without screaming. Off-white secondary for hero backgrounds keeps product front-and-center."
    },
    "typography": {
      "display_font": "Söhne",
      "body_font": "Inter",
      "pairing_rationale": "Söhne (or Inter Display fallback) brings the engineered geometric feel for headlines; Inter for body keeps reading effortless on long PDPs and emails. Both load fast and look identical in Notion-era apps customers already know.",
      "google_fonts_url": "https://fonts.googleapis.com/css2?family=Inter:wght@400;500;600;700&display=swap"
    },
    "logo_brief": {
      "mark_concept": "A simplified circular floor-plan glyph — implying lidar-mapped territory — wrapping the wordmark on the left side. Reads as 'mapped space' at a glance.",
      "wordmark_treatment": "Custom-tracked Söhne in primary color, slight letter rounding on 'o' to echo the circular mark.",
      "motif": "Lidar sweep arc — used as a subtle backdrop pattern on PDP and email headers, never as the primary brand asset.",
      "construction_principles": [
        "Mark can stand alone for app icon / favicon",
        "Minimum clear space = height of the 'o' on all sides",
        "No gradients — flat color only",
        "Accent orange reserved for CTAs and never the logo itself"
      ]
    },
    "imagery_style": {
      "photography_direction": "Real homes, lived-in not staged. Pet hair on the floor BEFORE the robot passes. Warm late-afternoon light. No cleaning-product blue-white sheen.",
      "lighting": "Natural / golden hour 70%, flat studio 30% (for product hero only)",
      "color_grading": "Slight warmth, mid-contrast, never oversaturated",
      "subject_framing": "Robot in environment, not robot in vacuum (pun intended). Always show the floor it's working on."
    },
    "motion_style": {
      "ease": "cubic-bezier(0.32, 0.72, 0, 1)",
      "duration_band_ms": "200-450"
    }
  },
  "email_brand_kit": {
    "header_color": "#0F1B2D",
    "footer_layout": "3-column: shop links | help center | unsubscribe + address. Logo lockup centered above. Social row below.",
    "signature_block": "— The Roborock team\nQuestions? Reply to this email — we read every one.",
    "tone_for_email": "Slightly warmer than web; conversational; uses contractions; treats the reader as a friend who already owns one robot and wants to know if the next one is worth it.",
    "preferred_subject_line_pattern": "{benefit_or_curiosity_hook} ({short_qualifier}) — keep ≤45 chars; lead with verb when possible. Examples: 'Stop rescuing it from under the chair.' / 'Your robot's brush, but no hair.'"
  },
  "cs_tone": {
    "voice_descriptors": ["empathetic", "concise", "solution-focused", "honest", "calm"],
    "do_phrases": [
      "I hear you — let's get this sorted today.",
      "Here's exactly what's happening and how we'll fix it:",
      "If that doesn't work, reply and I'll send a replacement no questions asked."
    ],
    "dont_phrases": [
      "We apologize for any inconvenience caused (corporate-speak)",
      "Per our policy (legalistic)",
      "As mentioned previously (passive-aggressive)",
      "Unfortunately we cannot (lead with the path forward, not the no)"
    ],
    "escalation_threshold": "Refund > $200 OR negative sentiment 2+ messages OR safety concern (battery/fire/injury) → human within 1 business hour",
    "default_signoff": "— Yours, {agent_first_name} | Roborock Support"
  },
  "welcome_offer": {
    "enabled": true,
    "type": "percent_off",
    "value": 10,
    "one_time_use": true,
    "expires_after_days": 14
  },
  "founders": [
    {
      "id": "founder_001",
      "name": "Richard Chang",
      "role": "Co-founder & CEO",
      "bio": "Spent eight years at iRobot before getting fed up with the gap between what robot vacuums claimed and what they actually did in his own apartment with two cats. Started Roborock in 2014 to build the robot he wanted to own. Still does the weekly hardware review himself.",
      "quote": "If a number isn't on our spec sheet, it's because we couldn't prove it in a real living room.",
      "linkedin_url": "https://www.linkedin.com/in/richard-chang-roborock-example"
    },
    {
      "id": "founder_002",
      "name": "Mei Lin",
      "role": "Co-founder & CTO",
      "bio": "PhD in robotics from CMU. Led the SLAM team at a self-driving company before realizing the same lidar techniques could solve the boring problem of mapping a one-bedroom flat. Owns the entire navigation stack at Roborock.",
      "quote": "Lidar is just one sensor. Knowing what to ignore is the actual work."
    },
    {
      "id": "founder_003",
      "name": "Daniel Wei",
      "role": "Head of Customer",
      "bio": "Joined in 2017 from a DTC mattress brand to make sure support stayed something a human did. Personally answers the first 50 escalations every week. Set the policy that we replace anything that breaks in year one, no questions.",
      "quote": "Returns aren't a cost center. They're the cheapest market research we get."
    }
  ],
  "values": [
    {
      "id": "value_001",
      "title": "Measure twice, claim once",
      "body": "Every spec on every product page comes from a test in a real living room with real pet hair. If we couldn't measure it, we don't say it."
    },
    {
      "id": "value_002",
      "title": "Engineered for the messy weeks",
      "body": "We design for the third week with a shedding golden retriever, not the showroom photo on day one. The boring case is the case that matters."
    },
    {
      "id": "value_003",
      "title": "A human answers",
      "body": "Every support email gets a human reply, usually within the hour. No chat-bots that loop you. No 'per our policy' deflection."
    },
    {
      "id": "value_004",
      "title": "We sell the part",
      "body": "Two-year warranty on robots, 90-day on accessories. After that we sell every part — brushes, filters, mop pads, batteries. Throwaway tech is not a clean home."
    },
    {
      "id": "value_005",
      "title": "Quiet on principle",
      "body": "No revolutionary AI. No game-changing breakthroughs. We do the unglamorous work of making the same thing 5% better every quarter. The cumulative compound is the product."
    }
  ],
  "sustainability_statement": {
    "summary": "We build robots designed to last and ship the parts to keep them running. The most sustainable robot vacuum is the one you don't replace.",
    "pillars": [
      {
        "title": "Repairable by design",
        "body": "Every consumable (brush, filter, mop pad, battery) is sold separately and field-replaceable with a screwdriver. We publish the manuals.",
        "metric": "100% of consumable parts available for purchase ≥ 5 years post-launch"
      },
      {
        "title": "Recycled aluminum housing",
        "body": "The S-Series Pro chassis is 60% post-consumer recycled aluminum, FSC-certified packaging.",
        "metric": "60% PCR aluminum (verified via UL ECVP)"
      },
      {
        "title": "Battery take-back",
        "body": "Mail us your dead lithium pack with a prepaid label and we partner with Call2Recycle for proper handling. No landfill.",
        "metric": "0 batteries to landfill since 2022"
      },
      {
        "title": "Carbon-neutral shipping (US)",
        "body": "All US ground shipments are offset via verified Gold Standard reforestation projects. Not a perfect answer, but a real one.",
        "metric": "12,400 tCO2e offset in 2025"
      }
    ],
    "certifications_referenced": ["UL Listed", "Energy Star", "FSC Packaging"],
    "report_url": "https://roborock-us.example.com/sustainability-2025.pdf"
  },
  "certifications": [
    { "name": "FCC Part 15", "issued_by": "US Federal Communications Commission", "scope": "all wireless products" },
    { "name": "UL Listed", "issued_by": "Underwriters Laboratories", "url": "https://www.ul.com/", "scope": "all robots and dock chargers" },
    { "name": "CE", "issued_by": "European Conformity", "scope": "all products sold in EU" },
    { "name": "RoHS", "issued_by": "EU Directive 2011/65/EU", "scope": "restricts hazardous substances" },
    { "name": "Energy Star", "issued_by": "US EPA", "scope": "S-Series Pro dock charging efficiency" },
    { "name": "FSC Packaging", "issued_by": "Forest Stewardship Council", "scope": "all retail packaging" }
  ],
  "press_mentions": [
    {
      "outlet": "Wirecutter",